{
  "id": "PAT-2026-05-06-2",
  "source_task": "FEAT-005-b",
  "type": "pattern",
  "title": "Resolución de directorios de tareas con soporte legacy",
  "context": "La transición a nombres de directorio slugless no debe romper el acceso a tareas existentes que aún conservan el formato antiguo.",
  "content": "El método find_task_dir implementa una resolución por prioridades: (1) coincidencia exacta con el nombre del directorio, (2) búsqueda por prefijo del task_id. Esto permite que el sistema encuentre tanto 'FEAT-001' como 'FEAT-001-slug-name' de forma transparente, facilitando una migración no destructiva.",
  "related": ["FEAT-005-b"],
  "created_at": "2026-05-06"
}
