{
  "id": "PAT-2026-05-29-1",
  "source_task": "FEAT-013",
  "type": "pattern",
  "title": "Negative grep assertions for documentation migration sweeps",
  "context": "Ensuring complete removal of legacy framework references (e.g. Python) during a migration.",
  "content": "Incorporate negative grep assertions (prefixed with '!') directly in the 02-contract.yaml verify.commands list. This programmatically guarantees that stale references, commands, paths, or variables do not survive a major refactor or migration in the documentation.",
  "related": ["FEAT-013"],
  "created_at": "2026-05-29"
}
