{
  "id": "DEC-2026-05-12-6",
  "source_task": "FEAT-005-h",
  "type": "decision",
  "title": "Retry preflight para tareas hijas failed",
  "context": "Necesidad de reintentar tareas hijas fallidas sin violar la prohibición de auto-rollback (quorum task back).",
  "content": "Se autoriza una ruta de 'preflight' para /q-implement que restaura una tarea hija de failed/ a active/, limpia artefactos de validación/revisión obsoletos y preserva el historial append-only de 07-trace.json. Esta ruta es sólo para hijas y bloquea si el worktree tiene cambios sucios.",
  "related": ["FEAT-005-h"],
  "created_at": "2026-05-12"
}
