{
  "id": "PAT-2026-05-12-6",
  "source_task": "FEAT-005-h",
  "type": "pattern",
  "title": "Patrón de Preflight de Retry en Entornos Aislados",
  "context": "Gestión de reintentos en arquitecturas que usan worktrees y artefactos de estado por tarea.",
  "content": "Antes de reintentar una tarea fallida: 1. Validar que el worktree esté limpio para evitar pérdida de trabajo humano. 2. Eliminar artefactos de 'veredicto final' (05/06) que contienen evidencia obsoleta. 3. Preservar el log de auditoría (07-trace) para mantener la trazabilidad de todos los intentos fallidos previos.",
  "related": ["FEAT-005-h"],
  "created_at": "2026-05-12"
}
