{
  "id": "DEC-2026-05-25-1",
  "source_task": "F-03-c",
  "type": "decision",
  "title": "Task ID Resolution Priority Tier",
  "context": "Porting Quorum find_task_dir resolution to Go.",
  "content": "Task ID resolution in Go maintains the exact three-tier priority as Python: 1. task_id inside 00-spec.yaml, 2. exact directory match, 3. prefix match (excluding child task suffixes).",
  "related": ["F-03-c"],
  "created_at": "2026-05-25"
}
